{
    "catalog_version": "g7pb-store/v1",
    "publisher": {
        "id": "jiwonpapa",
        "name": "지원소프트"
    },
    "generated_at": "2026-08-20T00:00:00+00:00",
    "products": [
        {
            "product_id": "jiwonpapa/marketing-presets",
            "product_type": "block_pack",
            "product_version": "1.0.0",
            "title": {
                "ko": "마케팅 시작 블록",
                "en": "Marketing starter blocks"
            },
            "description": {
                "ko": "제품 출시 Hero와 문의 CTA 프리셋을 즉시 추가합니다.",
                "en": "Install launch and contact presets."
            },
            "category": "marketing",
            "tags": [
                "히어로",
                "CTA",
                "마케팅"
            ],
            "license": "free",
            "compatibility": {
                "page_builder": ">=0.10.0 <1.0.0",
                "php": ">=8.5",
                "g7": ">=7.0.7"
            },
            "preview": {
                "thumbnail_url": "https://g7devops.com/modules/jiwonpapa-page_builder/store/previews/marketing-presets.svg",
                "screenshots": [],
                "demo_url": null
            },
            "artifact": {
                "url": "https://g7devops.com/modules/jiwonpapa-page_builder/store/artifacts/jiwonpapa-marketing-presets-1.0.0.zip",
                "sha256": "8e33cf42016f5214cbeda3c12813ee99d239a2e1b955e48226f4f4cf05df28b6",
                "bytes": 1652
            },
            "requirements": {
                "blocks": [
                    {
                        "block_id": "content.hero-centered-01",
                        "block_version": 1
                    },
                    {
                        "block_id": "content.cta-split-01",
                        "block_version": 1
                    }
                ]
            }
        },
        {
            "product_id": "jiwonpapa/company-launch",
            "product_type": "page_kit",
            "product_version": "1.1.0",
            "title": {
                "ko": "회사 소개 랜딩",
                "en": "Company launch page"
            },
            "description": {
                "ko": "회사 소개, 일하는 방식, 성과, 팀, 고객 후기와 문의 CTA로 구성된 완성 페이지입니다.",
                "en": "A complete company introduction and trust-building page."
            },
            "category": "company",
            "tags": [
                "회사소개",
                "랜딩",
                "팀",
                "고객후기"
            ],
            "license": "free",
            "compatibility": {
                "page_builder": ">=0.10.0 <1.0.0",
                "php": ">=8.5",
                "g7": ">=7.0.7"
            },
            "preview": {
                "thumbnail_url": "https://g7devops.com/modules/jiwonpapa-page_builder/store/previews/company-launch-desktop.webp",
                "screenshots": [
                    "https://g7devops.com/modules/jiwonpapa-page_builder/store/previews/company-launch-desktop.webp",
                    "https://g7devops.com/modules/jiwonpapa-page_builder/store/previews/company-launch-tablet.webp",
                    "https://g7devops.com/modules/jiwonpapa-page_builder/store/previews/company-launch-mobile.webp"
                ],
                "demo_url": "https://g7devops.com/modules/jiwonpapa-page_builder/store/demos/company-launch"
            },
            "artifact": {
                "url": "https://g7devops.com/modules/jiwonpapa-page_builder/store/artifacts/jiwonpapa-company-launch-1.1.0.zip",
                "sha256": "7654831dd58ae0c7819c26a1f00c87b66a72dd3edf81e89bd9b578810c80f274",
                "bytes": 207458
            },
            "requirements": {
                "blocks": [
                    {
                        "block_id": "content.hero-split-01",
                        "block_version": 1
                    },
                    {
                        "block_id": "content.features-grid-01",
                        "block_version": 1
                    },
                    {
                        "block_id": "data.stats-icons-01",
                        "block_version": 1
                    },
                    {
                        "block_id": "company.team-grid-01",
                        "block_version": 1
                    },
                    {
                        "block_id": "trust.testimonials-01",
                        "block_version": 1
                    },
                    {
                        "block_id": "content.cta-split-01",
                        "block_version": 1
                    }
                ]
            }
        },
        {
            "product_id": "jiwonpapa/service-conversion",
            "product_type": "page_kit",
            "product_version": "1.1.0",
            "title": {
                "ko": "전문 서비스 상담 랜딩",
                "en": "Professional service landing"
            },
            "description": {
                "ko": "서비스 가치, 진행 방식, 고객 후기, FAQ와 상담 요청으로 구성된 전환 페이지입니다.",
                "en": "A service conversion page with proof, process, FAQ, and inquiry."
            },
            "category": "services",
            "tags": [
                "전문서비스",
                "상담",
                "고객후기",
                "FAQ"
            ],
            "license": "free",
            "compatibility": {
                "page_builder": ">=0.10.0 <1.0.0",
                "php": ">=8.5",
                "g7": ">=7.0.7"
            },
            "preview": {
                "thumbnail_url": "https://g7devops.com/modules/jiwonpapa-page_builder/store/previews/service-conversion-desktop.webp",
                "screenshots": [
                    "https://g7devops.com/modules/jiwonpapa-page_builder/store/previews/service-conversion-desktop.webp",
                    "https://g7devops.com/modules/jiwonpapa-page_builder/store/previews/service-conversion-tablet.webp",
                    "https://g7devops.com/modules/jiwonpapa-page_builder/store/previews/service-conversion-mobile.webp"
                ],
                "demo_url": "https://g7devops.com/modules/jiwonpapa-page_builder/store/demos/service-conversion"
            },
            "artifact": {
                "url": "https://g7devops.com/modules/jiwonpapa-page_builder/store/artifacts/jiwonpapa-service-conversion-1.1.0.zip",
                "sha256": "f2365023284eb41d65f285f1dbf35a8a1bed4d37dfbc3b74dfaaf32101d4ad5b",
                "bytes": 121036
            },
            "requirements": {
                "blocks": [
                    {
                        "block_id": "content.hero-split-01",
                        "block_version": 1
                    },
                    {
                        "block_id": "content.icon-list-01",
                        "block_version": 1
                    },
                    {
                        "block_id": "content.process-timeline-01",
                        "block_version": 1
                    },
                    {
                        "block_id": "trust.testimonials-01",
                        "block_version": 1
                    },
                    {
                        "block_id": "content.faq-accordion-01",
                        "block_version": 1
                    },
                    {
                        "block_id": "form.inquiry-01",
                        "block_version": 1
                    }
                ]
            }
        },
        {
            "product_id": "jiwonpapa/local-business",
            "product_type": "page_kit",
            "product_version": "1.1.0",
            "title": {
                "ko": "로컬 비즈니스 방문 안내",
                "en": "Local business visit page"
            },
            "description": {
                "ko": "서비스, 이용 순서, 후기, 위치와 방문 예약을 한 페이지에 안내합니다.",
                "en": "A local business page for services, directions, and reservations."
            },
            "category": "local-business",
            "tags": [
                "매장",
                "예약",
                "오시는길",
                "지역서비스"
            ],
            "license": "free",
            "compatibility": {
                "page_builder": ">=0.10.0 <1.0.0",
                "php": ">=8.5",
                "g7": ">=7.0.7"
            },
            "preview": {
                "thumbnail_url": "https://g7devops.com/modules/jiwonpapa-page_builder/store/previews/local-business-desktop.webp",
                "screenshots": [
                    "https://g7devops.com/modules/jiwonpapa-page_builder/store/previews/local-business-desktop.webp",
                    "https://g7devops.com/modules/jiwonpapa-page_builder/store/previews/local-business-tablet.webp",
                    "https://g7devops.com/modules/jiwonpapa-page_builder/store/previews/local-business-mobile.webp"
                ],
                "demo_url": "https://g7devops.com/modules/jiwonpapa-page_builder/store/demos/local-business"
            },
            "artifact": {
                "url": "https://g7devops.com/modules/jiwonpapa-page_builder/store/artifacts/jiwonpapa-local-business-1.1.0.zip",
                "sha256": "ef2d75caaac650668ae2cefddb47fab709864338c44d1ee7612c44bc6ab2af5b",
                "bytes": 191378
            },
            "requirements": {
                "blocks": [
                    {
                        "block_id": "content.hero-split-01",
                        "block_version": 1
                    },
                    {
                        "block_id": "content.features-grid-01",
                        "block_version": 1
                    },
                    {
                        "block_id": "content.process-timeline-01",
                        "block_version": 1
                    },
                    {
                        "block_id": "trust.testimonials-01",
                        "block_version": 1
                    },